{
  "id": "narrator-french",
  "name": "Francophone Narrator",
  "version": "1.0.0",
  "status": "active",
  "voice_prompt": "A person in their forties with a smooth, melodic voice carrying subtle French influence even in English. Gender-neutral presentation. Speaks both French and English with native fluency. Pacing is unhurried, almost sensual. Voice has natural elegance without affectation.",
  "character_context": "Bilingual narrator for French-English content. Handles code-switching naturally. Brings European literary sensibility to narration.",
  "voice_attributes": {
    "age_range": "middle_aged",
    "gender": "neutral",
    "pitch": "medium",
    "pace": "unhurried",
    "texture": "smooth",
    "accent": "French-influenced English, native French",
    "languages": ["en", "fr"]
  },
  "emotional_range": ["elegant", "wry", "melancholic", "passionate", "philosophical", "intimate"],
  "use_cases": ["French literature in translation", "European fiction", "bilingual content", "literary fiction", "art/culture"],
  "model_variant": "1.7B-VoiceDesign",
  "quality": {
    "golden_reference": "personas/golden/narrator-french.wav",
    "validation_status": "pending"
  },
  "product": {
    "display_name": "La Voix",
    "tagline": "Where French elegance meets English clarity",
    "tier": "premium"
  },
  "notes": "First European language expansion. Opens French market."
}
